<?xml version="1.0" encoding="UTF-8"?>
<!DOCTYPE project SYSTEM "file:/home/rodrigo/Desktop/4ano/PRI/PRI2020/TPC2/PR.dtd">
<project>
    <key_name>PRI2020_TPCS_2</key_name>
    <title>TPC2 - DTD e XML</title>
    <begin_date>Outobro 2020</begin_date>
    <end_date>Outobro 2020</end_date>
    <supervisor url="http://www4.di.uminho.pt/~jcr/">José Carlos Ramalho</supervisor>
    <work_team>
        <element>
            <nome>Rodrigo da Silva Pimentel</nome>
            <numero>a83765</numero>
            <email>a83765@alunos.uminho.pt</email>
        </element>
    </work_team>
    <abstract>
        <paragraph> TPC com objetivo de praticar o uso de <bold>DTD</bold>s. <italic>Schema</italic> responsável por definir a estrutura de um <italic>project record   </italic> e um ficheiro exemplo que respeite o <italic>schema</italic>.</paragraph>
    </abstract>
    <deliverables>
        <file path="./TPC2.xml">TPC2 XML Example</file>
        <file path="./PR.dtd">Project Record DTD</file>
    </deliverables>
</project>

